{
    "$schema": "http://json-schema.org/draft-07/schema",
    "$id": "http://example.com/example.json",
    "type": "array",
    "title": "The Root Schema",
    "description": "The root schema comprises the entire JSON document.",
    "default": [],
    "additionalItems": true,
    "items": {
        "$id": "#/items",
        "type": "object",
        "title": "The Villager schema",
        "description": "Data for a Villager",
        "default": {},
        "examples": [
            {
                "birthday": {
                    "month": 1,
                    "day": 27,
                    "text": "January 27th"
                },
                "species": "Bird",
                "name": "Admiral",
                "data_url": "https://nookipedia.com/wiki/Admiral",
                "personality": "Cranky",
                "gender": "Male",
                "zodiac": "Aquarius"
            },
            {
                "data_url": "https://nookipedia.com/wiki/Agent_S",
                "personality": "Peppy",
                "gender": "Female",
                "zodiac": "Cancer",
                "birthday": {
                    "text": "July 2nd",
                    "month": 7,
                    "day": 2
                },
                "species": "Squirrel",
                "name": "Agent S"
            },
            {
                "zodiac": "Taurus",
                "birthday": {
                    "month": 4,
                    "day": 21,
                    "text": "April 21st"
                },
                "species": "Pig",
                "name": "Agnes",
                "data_url": "https://nookipedia.com/wiki/Agnes",
                "personality": "Sisterly",
                "gender": "Female"
            }
        ],
        "additionalProperties": true,
        "required": [
            "name",
            "species",
            "personality",
            "gender",
            "birthday",
            "zodiac",
            "data_url"
        ],
        "properties": {
            "name": {
                "$id": "#/items/properties/name",
                "type": "string",
                "title": "The Name Schema",
                "description": "Villager name.",
                "default": "",
                "examples": [
                    "Admiral"
                ]
            },
            "species": {
                "$id": "#/items/properties/species",
                "type": "string",
                "title": "The Species Schema",
                "description": "Villager species.",
                "default": "",
                "examples": [
                    "Bird"
                ]
            },
            "personality": {
                "$id": "#/items/properties/personality",
                "type": "string",
                "title": "The Personality Schema",
                "description": "Villager personality type.",
                "default": "",
                "examples": [
                    "Cranky"
                ]
            },
            "gender": {
                "$id": "#/items/properties/gender",
                "type": "string",
                "title": "The Gender Schema",
                "description": "Villager's listed gender.",
                "default": "",
                "examples": [
                    "Male"
                ]
            },
            "birthday": {
                "$id": "#/items/properties/birthday",
                "type": "object",
                "title": "The Birthday Schema",
                "description": "Contains data for a villager's birthday.",
                "default": {},
                "examples": [
                    {
                        "month": 1,
                        "day": 27,
                        "text": "January 27th"
                    }
                ],
                "additionalProperties": true,
                "required": [
                    "month",
                    "day",
                    "text"
                ],
                "properties": {
                    "month": {
                        "$id": "#/items/properties/birthday/properties/month",
                        "type": "integer",
                        "title": "The Month Schema",
                        "description": "Integer representation of villager's birth month.",
                        "default": 0,
                        "examples": [
                            1
                        ]
                    },
                    "day": {
                        "$id": "#/items/properties/birthday/properties/day",
                        "type": "integer",
                        "title": "The Day Schema",
                        "description": "Integer representation of villager's birth day.",
                        "default": 0,
                        "examples": [
                            27
                        ]
                    },
                    "text": {
                        "$id": "#/items/properties/birthday/properties/text",
                        "type": "string",
                        "title": "The Text Schema",
                        "description": "String representation of villager's birthday.",
                        "default": "",
                        "examples": [
                            "January 27th"
                        ]
                    }
                }
            },
            "zodiac": {
                "$id": "#/items/properties/zodiac",
                "type": "string",
                "title": "The Zodiac Schema",
                "description": "Zodiac sign villager's birthday falls under.",
                "default": "",
                "examples": [
                    "Aquarius"
                ]
            },
            "data_url": {
                "$id": "#/items/properties/data_url",
                "type": "string",
                "title": "The Data_url Schema",
                "description": "url data was scrapped from.",
                "default": "",
                "examples": [
                    "https://nookipedia.com/wiki/Admiral"
                ]
            }
        }
    }
}